{
  "report_date": "2026-05-24",
  "summary": "补录 2026-05-24 Steam 趋势：新品节前的 Steam 观察重点不是单个新游数量，而是 Demo/愿望单预热、热门即将推出列表和品类供给变化。昨日应作为 5 月下旬到 6 月新品节之间的前置观察基线。",
  "market_insights": [
    {
      "id": "steam_macro_2026_05_24_pre_next_fest",
      "title": "新品节前一周应建立观察基线",
      "summary": "在新品节正式放量前，先用热门即将推出、Demo 和 SteamDB 关注趋势建立基线，后续才能看出哪些项目是真正冒头。",
      "signal_level": "高",
      "source": "Steam Next Fest / Steam Popular Upcoming",
      "link": "https://store.steampowered.com/search/?filter=popularcomingsoon",
      "suggested_action": "把 Q3-Q4 2026、Demo 可玩、非 EA 且有清晰画面或机制差异的项目列入观察池。",
      "captured_at": "2026-05-24T10:00:00+08:00"
    },
    {
      "id": "steam_macro_2026_05_24_demo_quality",
      "title": "Demo 质量会决定新品节后是否值得跟进",
      "summary": "对于没有强发行结构的中小团队，Demo 页面、评测倾向和社区反馈比 PR 文案更可信。低于 80% 的公开口碑应直接降权或淘汰。",
      "signal_level": "中",
      "source": "Steam Demo / SteamDB",
      "link": "https://store.steampowered.com/search/?filter=popularnew",
      "suggested_action": "在 CRM 中保留 Demo 口碑、视频观感、社群入口和团队联系方式，不只存项目名。",
      "captured_at": "2026-05-24T10:00:00+08:00"
    },
    {
      "id": "steam_macro_2026_05_24_genre_density",
      "title": "卡牌/解谜/轻叙事供给密度高，需要更强筛选",
      "summary": "5 月下旬 Steam 上轻量卡牌、解谜和高视觉小品密度较高，但不是每个都值得 BD 跟进。判断标准应回到窗口、可传播性、团队可触达和中国区是否未占位。",
      "signal_level": "中",
      "source": "Steam Tags / SteamDB Charts",
      "link": "https://steamdb.info/charts/",
      "suggested_action": "把同质化 DBG、窗口过近的叙事解谜和已有成熟发行商占位项目直接从推进候选中剔除。",
      "captured_at": "2026-05-24T10:00:00+08:00"
    }
  ],
  "genre_signals": [
    {
      "id": "steam_genre_2026_05_24_card_strategy",
      "genre": "卡牌策略 / DBG",
      "signal": "该品类继续有供给，但需要强机制差异或题材包装才能穿透。",
      "why_it_matters": "B站能讲策略，但同质化卡牌会让内容和商务判断都变钝。",
      "bd_action": "优先看规则差异、Demo 反馈和团队触达；只靠卡牌构筑标签的不入推进。",
      "links": [
        "https://store.steampowered.com/tags/en/Deckbuilding/",
        "https://store.steampowered.com/tags/en/Roguelike%20Deckbuilder/"
      ]
    },
    {
      "id": "steam_genre_2026_05_24_visual_puzzle",
      "genre": "高视觉解谜 / Cozy",
      "signal": "美术风格项目容易获得首屏兴趣，但如果偏叙事或窗口过近，BD 价值有限。",
      "why_it_matters": "这类项目适合内容曝光，不一定适合发行深度介入。",
      "bd_action": "只把高视觉且窗口足够早的项目放入观察；发售 <60 天的只做内容名单。",
      "links": [
        "https://store.steampowered.com/tags/en/Cozy/",
        "https://store.steampowered.com/tags/en/Puzzle/"
      ]
    },
    {
      "id": "steam_genre_2026_05_24_voice_interaction",
      "genre": "语音互动 / 直播友好机制",
      "signal": "语音、联机、失败集锦和整活机制仍适合 B站传播，但必须验证稳定性。",
      "why_it_matters": "能被主播玩出梗的机制比普通玩法介绍更容易放大。",
      "bd_action": "看 Demo 稳定性、联机体验和中文社区合作意愿；没有可测版本先观察。",
      "links": [
        "https://store.steampowered.com/tags/en/Voice%20Control/",
        "https://store.steampowered.com/tags/en/Multiplayer/"
      ]
    }
  ],
  "items": [
    {
      "id": "steam_sample_2026_05_24_next_fest_watchlist",
      "title": "新品节 Watchlist 基线",
      "steam_app_id": null,
      "rank_bucket": "大盘入口",
      "signal": "先建立新品节前项目基线，后续看哪些项目的 Demo/愿望单/社区讨论出现连续增长。",
      "source": "Steam Next Fest / Popular Upcoming",
      "links": [
        "https://store.steampowered.com/sale/nextfest",
        "https://store.steampowered.com/search/?filter=popularcomingsoon"
      ],
      "bilibili_fit": "帮助提前锁定适合内容测试和 UP 主试玩的项目。",
      "reason": "用于宏观扫描，不直接代表单个推荐。",
      "auto_import": false,
      "captured_at": "2026-05-24T10:00:00+08:00"
    },
    {
      "id": "steam_sample_2026_05_24_steamdb_context",
      "title": "SteamDB 榜单作为大盘参照",
      "steam_app_id": null,
      "rank_bucket": "榜单参照",
      "signal": "SteamDB 大盘可以看 CCU 和关注趋势，但 BD 线索要结合窗口和发行结构筛选。",
      "source": "SteamDB",
      "links": [
        "https://steamdb.info/charts/",
        "https://steamdb.info/charts/?sort=trending"
      ],
      "bilibili_fit": "用于判断玩家兴趣和题材热度，而不是直接替代人工复核。",
      "reason": "先看宏观，再落到项目。",
      "auto_import": false,
      "captured_at": "2026-05-24T10:00:00+08:00"
    }
  ],
  "crm_candidates": []
}
